<?xml version="1.0" encoding="ISO-8859-1"?>
<Company xmlns:xsi="http://www.w3.org/2001/XMLSchema-instance" xsi:noNamespaceSchemaLocation="schema.xsd">
	<CustomerList>
		<Customer Id="100">
			<PrimaryInformation Title="Mr" FirstName="Johnathan" LastName="Smith" DateOfBirth="1968-12-01"/>
			<Contact EmailId="Johnathan.Smith@somedomain.com" MobilePhone="566093" Landline="9939393"/>
			<Address AddressLine1="Line 1" AddressLine2="" AddressLine3="" AddressLine4="" Region="" PostCode="SL1" Country="GB"/>
		</Customer>
		<Customer Id="101">
			<PrimaryInformation Title="Mrs" FirstName="Milly" LastName="Cook" DateOfBirth="1968-12-01"/>
			<Contact EmailId="Milly.Cook@somedomain.com" MobilePhone="0789918899" Landline="99319393"/>
			<Address AddressLine1="Line 1" AddressLine2="" AddressLine3="" AddressLine4="" Region="" PostCode="SL1" Country="GB"/>
		</Customer>
		<Customer Id="102">
			<PrimaryInformation Title="Mrs" FirstName="Joel " LastName="Reed" DateOfBirth="1978-12-01"/>
			<Contact EmailId="Joel.Reed@somedomain.com" MobilePhone="08393931" Landline="99319393"/>
			<Address AddressLine1="Line 1" AddressLine2="" AddressLine3="" AddressLine4="" Region="" PostCode="wl2" Country="GB"/>
		</Customer>		
		<Customer Id="104">
			<PrimaryInformation Title="Mr" FirstName="Eric" LastName="Shuman" DateOfBirth="1968-12-01"/>
			<Contact EmailId="Eric.Shuman@somedomain.com" MobilePhone="2032002" Landline="9939393"/>
			<Address AddressLine1="Line 1" AddressLine2="" AddressLine3="" AddressLine4="" Region="" PostCode="SL1" Country="GB"/>
		</Customer>
		<Customer Id="105">
			<PrimaryInformation Title="Mrs" FirstName="Jenny" LastName="Smith" DateOfBirth="1968-12-01"/>
			<Contact EmailId="Jenny.Smith@somedomain.com" MobilePhone="677748830" Landline="99319393"/>
			<Address AddressLine1="Line 1" AddressLine2="" AddressLine3="" AddressLine4="" Region="" PostCode="SL1" Country="GB"/>
		</Customer>
		<Customer Id="106">
			<PrimaryInformation Title="Mr" FirstName="Rowan" LastName="Boyle" DateOfBirth="1978-12-01"/>
			<Contact EmailId="Rowan.Boyle@somedomain.com" MobilePhone="3993827" Landline="99319393"/>
			<Address AddressLine1="Line 1" AddressLine2="" AddressLine3="" AddressLine4="" Region="" PostCode="wl2" Country="GB"/>
		</Customer>	
		<Customer Id="107">
			<PrimaryInformation Title="Miss" FirstName="Stacey" LastName="Durham" DateOfBirth="1968-12-01"/>
			<Contact EmailId="Stacey.Durham@somedomain.com" MobilePhone="90002000" Landline="9939393"/>
			<Address AddressLine1="Line 1" AddressLine2="" AddressLine3="" AddressLine4="" Region="" PostCode="SL1" Country="GB"/>
		</Customer>
		<Customer Id="108">
			<PrimaryInformation Title="Mr" FirstName="Cleo" LastName="Carson" DateOfBirth="1968-12-01"/>
			<Contact EmailId="Cleo.Carson@somedomain.com" MobilePhone="205666785" Landline="99319393"/>
			<Address AddressLine1="Line 1" AddressLine2="" AddressLine3="" AddressLine4="" Region="" PostCode="SL1" Country="GB"/>
		</Customer>
		<Customer Id="109">
			<PrimaryInformation Title="Miss" FirstName="Holly" LastName="Wilson" DateOfBirth="1978-12-01"/>
			<Contact EmailId="Holly.Wilson@somedomain.com" MobilePhone="9663325479" Landline="99319393"/>
			<Address AddressLine1="Line 1" AddressLine2="" AddressLine3="" AddressLine4="" Region="" PostCode="wl2" Country="GB"/>
		</Customer>		
		<Customer Id="110">
			<PrimaryInformation Title="Miss" FirstName="Daniella" LastName="Padilla" DateOfBirth="1968-12-01"/>
			<Contact EmailId="Daniella.Padilla@somedomain.com" MobilePhone="839399693" Landline="9939393"/>
			<Address AddressLine1="Line 1" AddressLine2="" AddressLine3="" AddressLine4="" Region="" PostCode="SL1" Country="GB"/>
		</Customer>
		<Customer Id="111">
			<PrimaryInformation Title="Mr" FirstName="Felix" LastName="Mendez" DateOfBirth="1968-12-01"/>
			<Contact EmailId="Felix.Mendez@somedomain.com" MobilePhone="66666931" Landline="99319393"/>
			<Address AddressLine1="Line 1" AddressLine2="" AddressLine3="" AddressLine4="" Region="" PostCode="SL1" Country="GB"/>
		</Customer>
		<Customer Id="112">
			<PrimaryInformation Title="Mrs" FirstName="Evangeline" LastName="Blake" DateOfBirth="1978-12-01"/>
			<Contact EmailId="Evangeline.Blake@somedomain.com" MobilePhone="559983931" Landline="99319393"/>
			<Address AddressLine1="Line 1" AddressLine2="" AddressLine3="" AddressLine4="" Region="" PostCode="wl2" Country="GB"/>
		</Customer>			
	</CustomerList>
	<GuideList>
		<Guide Id="1200">
			<Skills>
				<Skill Details="First Aid"/>
				<Skill Details="Mountain Class 1"/>
			</Skills>
			<PrimaryInformation Title="Miss" FirstName="Kelly" LastName="Armstorng" DateOfBirth="1990-12-01"/>
			<Contact EmailId="Kelly.Armstorng@somedomain.com" MobilePhone="180093" Landline="9933"/>
			<Address AddressLine1="Line 1" AddressLine2="" AddressLine3="" AddressLine4="" Region="" PostCode="W01" Country="GB"/>
		</Guide>
		<Guide Id="1201">
			<Skills>
				<Skill Details="First Aid"/>
				<Skill Details="Mountain Class 1"/>
			</Skills>
			<PrimaryInformation Title="Mr" FirstName="Marshal" LastName="Ulrich" DateOfBirth="1960-12-01"/>
			<Contact EmailId="Marshal.Ulrich@somedomain.com" MobilePhone="2380093" Landline="9933"/>
			<Address AddressLine1="Line 1" AddressLine2="" AddressLine3="" AddressLine4="" Region="" PostCode="W01" Country="GB"/>
		</Guide>
		<Guide Id="1202">
			<Skills>
				<Skill Details="First Aid"/>
				<Skill Details="Mountain Class 1"/>
			</Skills>
			<PrimaryInformation Title="Mr" FirstName="Jason" LastName="Bourne" DateOfBirth="1970-12-01"/>
			<Contact EmailId="Jason.Bourne@somedomain.com" MobilePhone="89880093" Landline="9933"/>
			<Address AddressLine1="Line 1" AddressLine2="" AddressLine3="" AddressLine4="" Region="" PostCode="W01" Country="GB"/>
		</Guide>	
		<Guide Id="1204">
			<Skills>
				<Skill Details="First Aid"/>
				<Skill Details="Mountain Class 1"/>
			</Skills>
			<PrimaryInformation Title="Miss" FirstName="Jenny" LastName="Armstorng" DateOfBirth="1990-12-01"/>
			<Contact EmailId="Jenny.armstrong@company.com" MobilePhone="776380093" Landline="9933"/>
			<Address AddressLine1="Line 1" AddressLine2="" AddressLine3="" AddressLine4="" Region="" PostCode="W01" Country="GB"/>
		</Guide>
		<Guide Id="1205">
			<Skills>
				<Skill Details="First Aid"/>
				<Skill Details="Mountain Class 1"/>
			</Skills>
			<PrimaryInformation Title="Mr" FirstName="Richard" LastName="Feynman" DateOfBirth="1960-12-01"/>
			<Contact EmailId="Richard.Feynman@somedomain.com" MobilePhone="567980093" Landline="9933"/>
			<Address AddressLine1="Line 1" AddressLine2="" AddressLine3="" AddressLine4="" Region="" PostCode="W01" Country="GB"/>
		</Guide>
		<Guide Id="1206">
			<Skills>
				<Skill Details="First Aid"/>
				<Skill Details="Mountain Class 1"/>
			</Skills>
			<PrimaryInformation Title="Mr" FirstName="Lucius" LastName="Feltman" DateOfBirth="1970-12-01"/>
			<Contact EmailId="Lucius.Feltman@somedomain.com" MobilePhone="327880093" Landline="9933"/>
			<Address AddressLine1="Line 1" AddressLine2="" AddressLine3="" AddressLine4="" Region="" PostCode="W01" Country="GB"/>
		</Guide>	
		<Guide Id="1207">
			<Skills>
				<Skill Details="First Aid"/>
				<Skill Details="Mountain Class 1"/>
			</Skills>
			<PrimaryInformation Title="Miss" FirstName="Missy" LastName="Carlton" DateOfBirth="1990-12-01"/>
			<Contact EmailId="Missy.Carlton@somedomain.com" MobilePhone="987680093" Landline="9933"/>
			<Address AddressLine1="Line 1" AddressLine2="" AddressLine3="" AddressLine4="" Region="" PostCode="W01" Country="GB"/>
		</Guide>
		<Guide Id="1208">
			<Skills>
				<Skill Details="First Aid"/>
				<Skill Details="Mountain Class 1"/>
			</Skills>
			<PrimaryInformation Title="Mr" FirstName="James" LastName="Bose" DateOfBirth="1960-12-01"/>
			<Contact EmailId="James.Bose@somedomain.com" MobilePhone="3325480093" Landline="9933"/>
			<Address AddressLine1="Line 1" AddressLine2="" AddressLine3="" AddressLine4="" Region="" PostCode="W01" Country="GB"/>
		</Guide>
		<Guide Id="1209">
			<Skills>
				<Skill Details="First Aid"/>
				<Skill Details="Mountain Class 1"/>
			</Skills>
			<PrimaryInformation Title="Mr" FirstName="Rick" LastName="Coffee" DateOfBirth="1970-12-01"/>
			<Contact EmailId="Rick.Coffee@somedomain.com" MobilePhone="9963280093" Landline="9933"/>
			<Address AddressLine1="Line 1" AddressLine2="" AddressLine3="" AddressLine4="" Region="" PostCode="W01" Country="GB"/>
		</Guide>			
	</GuideList>
	<DestinationList>
		<Destination Id="1" DestinationName="Ayr" DestinationType="BnB" Access="">
			<Contact EmailId="contacts@ayr.com" MobilePhone="10039993" Landline="33434"/>
			<Address AddressLine1="1 High Street" AddressLine2="Ayr" AddressLine3="" AddressLine4="" Region="" PostCode="AY01" Country="GB"/>
		</Destination>
		<Destination Id="2" DestinationName="Irvine" DestinationType="BnB" Access="">
			<Contact EmailId="contacts@@Irvine.com" MobilePhone="089995993" Landline="33434"/>
			<Address AddressLine1="2 High Street" AddressLine2="Irvine" AddressLine3="" AddressLine4="" Region="" PostCode="IR01" Country="GB"/>
		</Destination>
		<Destination Id="3" DestinationName="Ardrossan" DestinationType="BnB" Access="">
			<Contact EmailId="contacts@Ardrossan.com" MobilePhone="70899939993" Landline="33434"/>
			<Address AddressLine1="3 High Street" AddressLine2="Ardrossan" AddressLine3="" AddressLine4="" Region="" PostCode="AR01" Country="GB"/>
		</Destination>
		<Destination Id="4" DestinationName="Largs" DestinationType="BnB" Access="">
			<Contact EmailId="ft.1@Largs.com" MobilePhone="40049993" Landline="33434"/>
			<Address AddressLine1="4 High Street" AddressLine2="Largs" AddressLine3="" AddressLine4="" Region="" PostCode="LA01" Country="GB"/>
		</Destination>
		<Destination Id="11" DestinationName="Ludlow " DestinationType="Hotel" Access="">
			<Contact EmailId="frontdesk@Ludlow.com" MobilePhone="787976648" Landline="33434"/>